{
  "id": "example:record",
  "recordType": "Context.Relationship",
  "schemaVersion": 1,
  "createdAt": "2026-10-01T07:10:00.000Z",
  "updatedAt": "2026-10-01T07:10:00.000Z",
  "ownerId": "local:owner",
  "fromRef": "example",
  "relationType": "related-to",
  "toRef": "example",
  "authorRef": "example"
}